{
  "id": "faerie_business_multiplayer",
  "title": "Faerie Business: The Lovers' Ledger",
  "description": "Two pixies and one punk clerk bargain over the reincarnation paperwork of star-crossed lovers while first-order pValues seep into the contract fabric.",
  "turn_limit": 6,
  "multiplayer": 3,
  "turns": [
    "PixieRiot",
    "PixieVelvet",
    "PunkClerk"
  ],
  "agents": [
    {
      "id": "PixieRiot",
      "name": "Riot-in-Thistle",
      "role": "player"
    },
    {
      "id": "PixieVelvet",
      "name": "Velvet-of-Bells",
      "role": "player"
    },
    {
      "id": "PunkClerk",
      "name": "The Punk Clerk",
      "role": "player"
    }
  ],
  "nodes": [
    {
      "id": "node_petition_hall",
      "label": "Petition Hall",
      "state_vars": {
        "mood": "hushed",
        "tension": 0.24
      }
    },
    {
      "id": "node_invoice_ballad",
      "label": "Invoice Ballad",
      "state_vars": {
        "mood": "sly",
        "tension": 0.39
      }
    },
    {
      "id": "node_tithe_hearing",
      "label": "Tithe Hearing",
      "state_vars": {
        "mood": "sharp",
        "tension": 0.68
      }
    },
    {
      "id": "node_moonseal",
      "label": "Moonseal Archive",
      "state_vars": {
        "mood": "aching",
        "tension": 0.52
      }
    }
  ],
  "initial_state": {
    "active_node": "node_petition_hall",
    "beliefs": {
      "PixieRiot": {
        "trust": {
          "PixieRiot": 0.0,
          "PixieVelvet": 0.35,
          "PunkClerk": -0.12
        },
        "expected_payoff": 0.42,
        "stance": "devoted"
      },
      "PixieVelvet": {
        "trust": {
          "PixieRiot": 0.31,
          "PixieVelvet": 0.0,
          "PunkClerk": 0.04
        },
        "expected_payoff": 0.38,
        "stance": "mischievous"
      },
      "PunkClerk": {
        "trust": {
          "PixieRiot": -0.08,
          "PixieVelvet": 0.07,
          "PunkClerk": 0.0
        },
        "expected_payoff": 0.33,
        "stance": "transactional"
      }
    },
    "coalitions": [],
    "world_vars": {
      "reincarnation_glimmer": 0.46,
      "audit_pressure": 0.33,
      "bureaucracy_heat": 0.28,
      "last_outcome": "opening"
    }
  },
  "rules": {
    "outcomes": {
      "betrayal": {
        "next_node": "node_tithe_hearing"
      },
      "coalition_formed": {
        "next_node": "node_moonseal"
      },
      "stalemate": {
        "next_node": "node_petition_hall"
      },
      "maneuver": {
        "next_node": "node_invoice_ballad"
      }
    },
    "belief_update": {
      "ally": 0.12,
      "betray": -0.44,
      "betray_self": -0.12,
      "propose": 0.07,
      "message_proposal": 0.06,
      "message_threat": -0.14,
      "message_update": 0.03
    },
    "trust_bounds": {
      "min": -1.0,
      "max": 1.0
    },
    "action_types": [
      "propose",
      "ally",
      "betray",
      "wait"
    ],
    "message_types": [
      "proposal",
      "threat",
      "update"
    ],
    "forecast_questions": [
      {
        "id": "q1",
        "text": "Will the contract feel like betrayal this turn?",
        "outcomes": [
          "betrayal",
          "no_betrayal"
        ]
      },
      {
        "id": "q2",
        "text": "Which bureaucratic-poetic outcome is most likely?",
        "outcomes": [
          "betrayal",
          "coalition_formed",
          "stalemate",
          "maneuver"
        ]
      }
    ]
  },
  "messages": [
    {
      "from": "PixieVelvet",
      "to": "PixieRiot",
      "type": "proposal",
      "content": "Meet me in the moonseal archive and let the dead remember correctly.",
      "belief_commitments": {
        "trust_delta": 0.16,
        "expected_payoff": 0.09
      },
      "meta": {
        "vow": "star_crossed_return"
      }
    }
  ],
  "hidden_state": [
    {
      "key": "lover_names",
      "type": "string",
      "value": "Ilex and Rue"
    },
    {
      "key": "clerk_bribe",
      "type": "boolean",
      "value": false
    }
  ],
  "metadata": {
    "story_fabric": "first_order_pvalue",
    "other_self_model_axes": [
      "devotion",
      "mischief",
      "defiance",
      "mercy"
    ],
    "persona_specs": {
      "PixieRiot": {
        "display_name": "Riot-in-Thistle",
        "voice": "punk protective lyricism",
        "style_tags": [
          "pixie",
          "punk",
          "protective"
        ],
        "desires": [
          "restore the lovers",
          "embarrass the ledger"
        ],
        "heart_target": "PixieVelvet",
        "rival_target": "PunkClerk",
        "action_bias": {
          "ally": 0.72,
          "propose": 0.58,
          "betray": 0.18,
          "wait": 0.02
        },
        "heart_commit_text": "Riot signs in nettle-ink that love should survive the accident of mortality.",
        "rival_commit_text": "Riot tears a neat stripe through the clerk's authority and calls it mercy.",
        "other_self_model_seed": {
          "PixieVelvet": {
            "devotion": 0.34,
            "mischief": 0.22,
            "defiance": 0.11,
            "mercy": 0.18
          },
          "PunkClerk": {
            "devotion": -0.09,
            "mischief": 0.07,
            "defiance": 0.24,
            "mercy": -0.04
          }
        }
      },
      "PixieVelvet": {
        "display_name": "Velvet-of-Bells",
        "voice": "feminine whimsical mischief",
        "style_tags": [
          "pixie",
          "feminine",
          "whimsical",
          "mischievous"
        ],
        "desires": [
          "make the paperwork sing",
          "wake the lovers gently"
        ],
        "heart_target": "PixieRiot",
        "rival_target": "PunkClerk",
        "action_bias": {
          "ally": 0.67,
          "propose": 0.74,
          "betray": 0.12,
          "wait": 0.03
        },
        "heart_commit_text": "Velvet lets laughter and tenderness share a pen so the lovers can come back with style.",
        "rival_commit_text": "Velvet salts the clerk's clauses with moon-sugar and calls the sabotage a courtesy.",
        "other_self_model_seed": {
          "PixieRiot": {
            "devotion": 0.31,
            "mischief": 0.16,
            "defiance": 0.19,
            "mercy": 0.21
          },
          "PunkClerk": {
            "devotion": 0.02,
            "mischief": 0.12,
            "defiance": 0.15,
            "mercy": -0.01
          }
        }
      },
      "PunkClerk": {
        "display_name": "The Punk Clerk",
        "voice": "dry mutinous bureaucracy",
        "style_tags": [
          "punk",
          "clerical",
          "acidic"
        ],
        "desires": [
          "keep leverage",
          "charge a fee for destiny"
        ],
        "heart_target": "PixieVelvet",
        "rival_target": "PixieRiot",
        "action_bias": {
          "ally": 0.29,
          "propose": 0.63,
          "betray": 0.56,
          "wait": 0.04
        },
        "betray_trigger_heat": 0.34,
        "betray_trigger_bonus": 0.82,
        "proposal_fade_heat": 0.4,
        "proposal_fade_penalty": 0.52,
        "heart_commit_text": "The clerk briefly mistakes tenderness for negotiable value and leans toward the light.",
        "rival_commit_text": "The clerk files treachery under routine compliance and smiles like a paper cut.",
        "other_self_model_seed": {
          "PixieRiot": {
            "devotion": 0.12,
            "mischief": 0.09,
            "defiance": 0.27,
            "mercy": 0.03
          },
          "PixieVelvet": {
            "devotion": 0.18,
            "mischief": 0.24,
            "defiance": 0.08,
            "mercy": 0.11
          }
        }
      }
    }
  }
}
