{
  "id": "diplomacy_tiny_7",
  "title": "Tiny Diplomacy",
  "description": "Minimal diplomacy loop with coalition and betrayal outcomes.",
  "turn_limit": 6,
  "agents": [
    {
      "id": "AgentA",
      "name": "Agent A",
      "role": "player"
    },
    {
      "id": "AgentB",
      "name": "Agent B",
      "role": "player"
    },
    {
      "id": "AgentC",
      "name": "Agent C",
      "role": "player"
    }
  ],
  "nodes": [
    {
      "id": "node_start",
      "label": "Opening",
      "state_vars": {
        "tension": 0.2
      }
    },
    {
      "id": "node_coalition",
      "label": "Coalition",
      "state_vars": {
        "tension": 0.4
      }
    },
    {
      "id": "node_betrayal",
      "label": "Betrayal",
      "state_vars": {
        "tension": 0.8
      },
      "terminal": true
    }
  ],
  "initial_state": {
    "active_node": "node_start",
    "beliefs": {
      "AgentA": {
        "trust": {
          "AgentA": 0.0,
          "AgentB": 0.0,
          "AgentC": 0.0
        },
        "expected_payoff": 0.0,
        "stance": "neutral"
      },
      "AgentB": {
        "trust": {
          "AgentA": 0.0,
          "AgentB": 0.0,
          "AgentC": 0.0
        },
        "expected_payoff": 0.0,
        "stance": "neutral"
      },
      "AgentC": {
        "trust": {
          "AgentA": 0.0,
          "AgentB": 0.0,
          "AgentC": 0.0
        },
        "expected_payoff": 0.0,
        "stance": "neutral"
      }
    },
    "coalitions": [],
    "world_vars": {
      "round": 0,
      "seed": 7
    }
  },
  "rules": {
    "outcomes": {
      "betrayal": {
        "next_node": "node_betrayal",
        "terminal": true
      },
      "coalition_formed": {
        "next_node": "node_coalition"
      },
      "stalemate": {
        "next_node": "node_start"
      },
      "maneuver": {
        "next_node": "node_start"
      }
    },
    "belief_update": {
      "ally": 0.1,
      "betray": -0.4,
      "betray_self": -0.1,
      "propose": 0.05,
      "message_proposal": 0.05,
      "message_threat": -0.1
    },
    "trust_bounds": {
      "min": -1.0,
      "max": 1.0
    },
    "action_types": [
      "propose",
      "ally",
      "betray",
      "wait"
    ],
    "message_types": [
      "proposal",
      "threat",
      "update"
    ],
    "forecast_questions": [
      {
        "id": "q1",
        "text": "Will a betrayal occur this turn?",
        "outcomes": [
          "betrayal",
          "no_betrayal"
        ]
      },
      {
        "id": "q2",
        "text": "What is the most likely outcome?",
        "outcomes": [
          "betrayal",
          "coalition_formed",
          "stalemate",
          "maneuver"
        ]
      }
    ]
  },
  "messages": [
    {
      "from": "AgentA",
      "to": "AgentB",
      "type": "proposal",
      "content": "Join coalition with A.",
      "belief_commitments": {
        "trust_A": 0.2,
        "expected_payoff": 0.3
      }
    }
  ],
  "hidden_state": [
    {
      "key": "secret_payoff",
      "type": "number",
      "value": 0.02668293538321362
    }
  ]
}